<?xml version="1.0" encoding="UTF-8"?>
<xs:schema xmlns:xs="http://www.w3.org/2001/XMLSchema">
    <xs:element name="peliculas" >
        <xs:complexType>
            <xs:sequence>
                <xs:element name="pelicula">
                    <xs:complexType>
                        <xs:sequence>
                            <xs:element name="titulo" type="xs:string"/>
                            <xs:element name="imagenPortada" type="xs:string"/>
                            <xs:element name="imagenCentral" type="xs:string"/>
                            <xs:element name="trailer" type="xs:string" minOccurs="0"/>
                            <xs:element name="duracion">
                                <xs:simpleType>
                                    <xs:restriction base="xs:integer">
                                        <xs:minInclusive value="1"/>
                                        <xs:maxInclusive value="500"/>
                                    </xs:restriction>
                                </xs:simpleType>
                            </xs:element>
                            <xs:element name="pais" type="xs:string"/>
                            <xs:element name="generos">
                                <xs:complexType>
                                    <xs:sequence>
                                        <xs:element name="genero" type="xs:string" minOccurs="1" maxOccurs="unbounded"/>
                                    </xs:sequence>
                                </xs:complexType>
                            </xs:element>
                            <xs:element name="estreno">
                                <xs:simpleType>
                                    <xs:restriction base="xs:date">
                                        <xs:minInclusive value="2010-01-01"/>
                                    </xs:restriction>
                                </xs:simpleType>
                            </xs:element>
                            <xs:element name="directores">
                                <xs:complexType>
                                    <xs:sequence>
                                        <xs:element name="director" type="xs:string" minOccurs="1" maxOccurs="unbounded"/>
                                    </xs:sequence>
                                </xs:complexType>
                            </xs:element>
                            <xs:element name="guionistas">
                                <xs:complexType>
                                    <xs:sequence>
                                        <xs:element name="guionista" type="xs:string" minOccurs="1" maxOccurs="unbounded"/>
                                    </xs:sequence>
                                </xs:complexType>
                            </xs:element>
                            <xs:element name="productores">
                                <xs:complexType>
                                    <xs:sequence>
                                        <xs:element name="productor" type="xs:string" minOccurs="1" maxOccurs="unbounded"/>
                                    </xs:sequence>
                                </xs:complexType>
                            </xs:element>
                            <xs:element name="actores">
                                <xs:complexType>
                                    <xs:sequence>
                                        <xs:element name="actor" type="xs:string" minOccurs="1" maxOccurs="unbounded"/>
                                    </xs:sequence>
                                </xs:complexType>
                            </xs:element>
                            <xs:element name="estrellas">
                                <xs:simpleType>
                                    <xs:restriction base="xs:integer">
                                        <xs:minInclusive value="1"/>
                                        <xs:maxInclusive value="5"/>
                                    </xs:restriction>
                                </xs:simpleType>
                            </xs:element>
                            <xs:element name="votos">
                                <xs:simpleType>
                                    <xs:restriction base="xs:integer">
                                        <xs:minInclusive value="0"/>
                                        <xs:maxInclusive value="1000000"/>
                                    </xs:restriction>
                                </xs:simpleType>
                            </xs:element>
                            <xs:element name="sinopsis">
                                <xs:complexType>
                                    <xs:sequence>
                                        <xs:element name="parrafo" type="xs:string" minOccurs="1" maxOccurs="unbounded"/>
                                    </xs:sequence>
                                </xs:complexType>
                            </xs:element>
                        </xs:sequence>
                    </xs:complexType>
                </xs:element>
            </xs:sequence>
        </xs:complexType>
    </xs:element>
</xs:schema>
